{
  "title": "HTML 汇报决策质量自检",
  "summary": "**结论：已把汇报质量从写作建议变成 advisory 质量门槛。**",
  "status": "complete",
  "template": "implementation-handoff",
  "renderMode": "runtime-cdn",
  "intent": {
    "audience": "Skill Hub maintainer",
    "primaryQuestion": "这次是否避免了为清空 warning 过度使用富文本？",
    "decision": "接受；后续 HTML 汇报先判断 warning 是否降低决策成本，再决定修复或保留。",
    "timeBudget": "2 分钟",
    "artifactKind": "handoff",
    "successCriteria": [
      "warning 标明 advisory",
      "富渲染只服务决策",
      "保留噪音 warning 时说明理由"
    ]
  },
  "sections": [
    {
      "type": "data-table",
      "title": "自检结论",
      "group": "summary",
      "summary": "warning 不再被当成必须清空的待办。",
      "columns": ["风险", "修正", "结果"],
      "rows": [
        ["过度卖弄富文本", "rich-content warning 改成 consider only when faster than prose", "先判断再渲染"],
        ["清空 warning 成为目标", "文档写明 warning != required fix", "允许保留并解释"],
        ["汇报发散", "BLUF + Top 3 + CTA 仍优先", "富文本不抢主线"]
      ]
    },
    {
      "type": "mermaid",
      "title": "warning 决策链路",
      "group": "details",
      "status": "ready",
      "summary": "只有能降低决策成本的 warning 才需要改内容。",
      "content": "flowchart LR\n  A[\"validator warning\"] --> B{\"是否降低决策成本？\"}\n  B -->|是| C[\"修复结构或证据\"]\n  B -->|否| D[\"保留 warning 并说明理由\"]\n  C --> E[\"交付\"]\n  D --> E"
    },
    {
      "type": "code",
      "title": "warning 文案证据",
      "group": "evidence",
      "status": "ready",
      "summary": "validator 文案明确是 advisory，而不是 hard gate。",
      "language": "javascript",
      "filePath": ".codex/skills/html-work-reports/scripts/validate-html-report.mjs",
      "startLine": 133,
      "highlightLines": [133, 163, 167],
      "content": "warnings.push(\"advisory: decision brief: lead with BLUF in the first sentence and keep it under 90 chars\");\nwarnings.push(\"advisory: rich content opportunity: consider Mermaid only when flow, routing, call-path, architecture, or trigger sequences would be faster than prose\");\nwarnings.push(\"advisory: rich content opportunity: consider code or diff only when file-and-line evidence is central to the report\");"
    },
    {
      "type": "markdown",
      "title": "边界确认",
      "group": "risks",
      "status": "ready",
      "content": "- **不是清空 warning 的游戏**：warning 是自检提示，不是自动修复指令。\n- **不是强制富文本**：Mermaid/code/diff 只有在更快解释复杂关系时才用。\n- **不是降低验收标准**：hard issue 仍失败；advisory warning 要判断和说明。"
    }
  ],
  "claims": [
    {
      "id": "claim-advisory-warning",
      "statement": "validator warning 已明确为 advisory，避免被误解成必须清空的任务。",
      "kind": "conclusion",
      "evidenceIds": ["e-validator-copy", "e-pattern-warning-policy"],
      "confidence": "high"
    },
    {
      "id": "claim-rich-boundary",
      "statement": "富渲染机会只在能降低阅读成本时触发，不再鼓励为了展示能力而加图或代码。",
      "kind": "conclusion",
      "evidenceIds": ["e-skill-contract", "e-focused-test"],
      "confidence": "high"
    },
    {
      "id": "claim-boundary",
      "statement": "本次仍只收紧静态 HTML 工作汇报，不进入生产 UI 或通用前端构建。",
      "kind": "risk",
      "evidenceIds": ["e-boundary-validation"],
      "confidence": "high"
    }
  ],
  "evidence": [
    {
      "id": "e-skill-contract",
      "kind": "file",
      "label": "warning advisory 规则",
      "filePath": ".codex/skills/html-work-reports/SKILL.md",
      "line": 69,
      "status": "pass",
      "trustLevel": "trusted-generated"
    },
    {
      "id": "e-pattern-warning-policy",
      "kind": "file",
      "label": "Warning Policy",
      "filePath": ".codex/skills/html-work-reports/references/html-report-patterns.md",
      "line": 184,
      "status": "pass",
      "trustLevel": "trusted-generated"
    },
    {
      "id": "e-validator-copy",
      "kind": "file",
      "label": "advisory warning 文案",
      "filePath": ".codex/skills/html-work-reports/scripts/validate-html-report.mjs",
      "line": 133,
      "status": "pass",
      "trustLevel": "trusted-generated"
    },
    {
      "id": "e-focused-test",
      "kind": "command",
      "label": "聚焦测试",
      "command": "bun test ./tests/htmlWorkReportsSkill.test.ts",
      "value": "31 pass，416 expect() calls",
      "status": "pass",
      "trustLevel": "trusted-generated"
    },
    {
      "id": "e-boundary-validation",
      "kind": "command",
      "label": "完整验证",
      "command": "bun run validate",
      "value": "107 pass，1065 expect() calls",
      "status": "pass",
      "trustLevel": "trusted-generated"
    }
  ],
  "verification": [
    {
      "label": "OpenSpec",
      "status": "pass",
      "detail": "openspec validate advance-html-work-reports-decision-quality"
    },
    {
      "label": "聚焦测试",
      "status": "pass",
      "detail": "bun test ./tests/htmlWorkReportsSkill.test.ts"
    },
    {
      "label": "完整验证",
      "status": "pass",
      "detail": "bun run validate"
    },
    {
      "label": "报告浏览器验收",
      "status": "pass",
      "detail": "validate-html-report.mjs reports/html-work-reports-decision-brief-self-check.html --require-browser"
    },
    {
      "label": "空白检查",
      "status": "pass",
      "detail": "git diff --check"
    }
  ],
  "nextActions": [
    "以后 HTML 汇报先判断 validator warnings 是否降低决策成本；能解释为噪音的 warning 保留并说明。",
    "不要为了清空 warning 添加 Mermaid、code、diff、chart、claim 或控件。"
  ]
}
