{
  "title": "HTML 汇报漏触发复盘",
  "summary": "**结论：缺口在触发合同，不在生成能力。** 已把完成态 OpenSpec、实现、验收交付写成默认触发，并用路由文档、专项测试和浏览器验收锁住。",
  "status": "complete",
  "template": "implementation-handoff",
  "renderMode": "runtime-cdn",
  "intent": {
    "audience": "Skill Hub maintainer",
    "primaryQuestion": "哪条触发规则让这次应有 HTML 汇报却漏掉？",
    "decision": "完成态工程交付默认给 HTML 汇报；生产 UI、slide deck、bundled app 仍排除。",
    "timeBudget": "2 分钟",
    "artifactKind": "handoff",
    "successCriteria": [
      "默认触发写进 SKILL.md",
      "路由文档同步",
      "专项测试与浏览器验收通过"
    ]
  },
  "sections": [
    {
      "type": "data-table",
      "title": "触发合同修复",
      "group": "changes",
      "summary": "4 个入口从模糊判断改成完成态默认汇报。",
      "columns": [
        "入口",
        "之前",
        "现在",
        "结果"
      ],
      "rows": [
        [
          "SKILL description",
          "依赖显式“需要 HTML”判断",
          "完成态工程交付默认加载",
          "少一次主观漏判"
        ],
        [
          "Decision Rule",
          "只覆盖 Markdown wall",
          "OpenSpec apply/archive 完成后默认触发",
          "本次场景被纳入"
        ],
        [
          "Trigger Examples",
          "没有 OpenSpec 验收汇报示例",
          "新增 apply acceptance report 示例",
          "后续更容易命中"
        ],
        [
          "Routing docs",
          "只说非平凡完成结论",
          "多文件工程 handoff 默认 HTML",
          "与项目路由一致"
        ]
      ]
    },
    {
      "type": "mermaid",
      "title": "触发决策链路",
      "group": "changes",
      "status": "ready",
      "summary": "把本次漏判改成默认路由，而不是依赖用户点名 HTML。",
      "content": "flowchart LR\n  A[\"完成态 OpenSpec / 实现 / 验收\"] --> B{\"非平凡工程交付？\"}\n  B -->|是| C[\"默认加载 html-work-reports\"]\n  C --> D[\"生成 HTML 汇报 + 验证链接\"]\n  B -->|否| E[\"普通聊天回复\"]\n  D --> F[\"仍排除 production UI / slide deck / bundled app\"]"
    },
    {
      "type": "code",
      "title": "触发描述证据",
      "group": "evidence",
      "status": "ready",
      "summary": "用精确片段证明触发合同已经覆盖完成态交付。",
      "language": "yaml",
      "filePath": ".codex/skills/html-work-reports/SKILL.md",
      "startLine": 3,
      "highlightLines": [3],
      "content": "description: Load when completed implementation, OpenSpec, validation, or review work has a complete conclusion needing a concise Chinese-first self-contained HTML report, plan, status dashboard, research explainer, architecture walkthrough, or lightweight export editor; skip permission pauses, simple chat answers, production UI, slide decks, and bundled web apps."
    },
    {
      "type": "data-table",
      "title": "验收信号",
      "group": "verification",
      "summary": "红灯证明漏触发，绿灯证明合同被锁住。",
      "columns": [
        "检查",
        "结果",
        "信号"
      ],
      "rows": [
        [
          "触发范围断言",
          "通过",
          "覆盖 implementation、OpenSpec、validation gates"
        ],
        [
          "聚焦测试",
          "通过",
          "bun test ./tests/htmlWorkReportsSkill.test.ts"
        ],
        [
          "浏览器验收",
          "通过",
          "validate-html-report.mjs --require-browser"
        ]
      ]
    },
    {
      "type": "markdown",
      "title": "边界不变",
      "group": "risks",
      "status": "ready",
      "content": "- **只改完成态工程汇报触发**：不进入 production UI、slide deck、bundled app 或通用 frontend builder。\n- **报告仍走 JSON fixture + generator**：不是手写一次性页面。\n- **验收必须过 validator + browser**：布局、锚点、复制按钮都要被检查。"
    }
  ],
  "claims": [
    {
      "id": "claim-trigger-root-cause",
      "statement": "漏掉 HTML 汇报的直接原因是触发合同没覆盖完成态 OpenSpec、实现和验收交付。",
      "kind": "conclusion",
      "evidenceIds": [
        "e-skill-description",
        "e-focused-test-red"
      ],
      "confidence": "high"
    },
    {
      "id": "claim-boundary-preserved",
      "statement": "修复只扩大完成态工程交付汇报，不改变生产 UI、slide deck、bundled app 的排除边界。",
      "kind": "conclusion",
      "evidenceIds": [
        "e-routing-docs",
        "e-focused-test-green"
      ],
      "confidence": "high"
    }
  ],
  "evidence": [
    {
      "id": "e-skill-description",
      "kind": "file",
      "label": "技能触发描述和 Decision Rule",
      "filePath": ".codex/skills/html-work-reports/SKILL.md",
      "line": 3,
      "status": "pass",
      "trustLevel": "trusted-generated"
    },
    {
      "id": "e-routing-docs",
      "kind": "file",
      "label": "项目路由文档",
      "filePath": "docs/skill-routing.md",
      "line": 37,
      "status": "pass",
      "trustLevel": "trusted-generated"
    },
    {
      "id": "e-focused-test-red",
      "kind": "command",
      "label": "触发范围红灯",
      "command": "bun test ./tests/htmlWorkReportsSkill.test.ts",
      "value": "新增断言后 3 tests failed，失败点集中在缺少 completed implementation、OpenSpec apply、默认触发说明。",
      "status": "pass",
      "trustLevel": "trusted-generated"
    },
    {
      "id": "e-focused-test-green",
      "kind": "command",
      "label": "触发范围绿灯",
      "command": "bun test ./tests/htmlWorkReportsSkill.test.ts",
      "value": "28 pass，0 fail，386 expect() calls。",
      "status": "pass",
      "trustLevel": "trusted-generated"
    }
  ],
  "verification": [
    {
      "label": "专项测试",
      "status": "pass",
      "detail": "bun test ./tests/htmlWorkReportsSkill.test.ts"
    },
    {
      "label": "边界复查",
      "status": "pass",
      "detail": "diff 未引入 production UI、slide deck、bundled app 或通用 frontend builder"
    },
    {
      "label": "浏览器验收",
      "status": "pass",
      "detail": "validate-html-report.mjs reports/html-work-reports-trigger-scope-retro.html --require-browser"
    }
  ],
  "nextActions": [
    "今后完成 OpenSpec apply/archive 或多文件实现后，默认附 HTML 汇报。",
    "最终回复只保留一句结论、报告链接和验证命令，不复述整份报告。"
  ]
}
