{
  "title": "Chart accessibility stress report",
  "summary": "The chart contract is usable only when the takeaway, source, alt text, and data table remain visible.",
  "status": "review",
  "template": "research-explainer",
  "renderMode": "runtime-cdn",
  "generatedAt": "2026-05-18T00:00:00.000Z",
  "intent": {
    "audience": "reviewer",
    "primaryQuestion": "Can a reader audit the chart without hover, scripts, or color-only meaning?",
    "decision": "Accept the chart contract when the table fallback and evidence links are present.",
    "timeBudget": "3m",
    "artifactKind": "review",
    "successCriteria": [
      "The chart has a written takeaway.",
      "The underlying values are available as a table.",
      "The source and evidence are reachable from the chart and claim."
    ]
  },
  "claims": [
    {
      "id": "claim-chart-contract",
      "statement": "Bounded charts can improve scan speed without replacing precise data.",
      "kind": "conclusion",
      "evidenceIds": ["evidence-chart-fixture"],
      "confidence": "high",
      "dateRange": "2026-05-18",
      "knownLimits": ["Only small explanatory chart types are supported."]
    }
  ],
  "sections": [
    {
      "type": "markdown",
      "title": "Review conclusion",
      "group": "summary",
      "status": "ready",
      "trustLevel": "mixed-trust",
      "content": "## Conclusion\n\n- **Accept the bounded chart path** when every visual includes a source, alt text, and table fallback.\n- Unsafe input like <img src=x onerror=alert(1)> must stay inert."
    },
    {
      "type": "chart",
      "title": "Validation coverage by contract area",
      "group": "main",
      "status": "ready",
      "chart": {
        "type": "bar",
        "title": "Validation coverage by contract area",
        "takeaway": "Intent, claims, charts, and trust boundaries all have deterministic checks.",
        "data": [
          { "area": "Intent", "checks": 4, "state": "covered" },
          { "area": "Claims", "checks": 5, "state": "covered" },
          { "area": "Charts", "checks": 6, "state": "covered" },
          { "area": "Trust", "checks": 4, "state": "covered" }
        ],
        "encoding": {
          "label": "area",
          "value": "checks",
          "status": "state"
        },
        "source": {
          "label": "Fixture acceptance matrix",
          "url": "https://skill-hub.local/fixtures/chart-accessibility-stress-report.json",
          "accessedAt": "2026-05-18"
        },
        "altText": "Bar chart showing deterministic checks for intent, claims, charts, and trust boundaries.",
        "tableFallback": {
          "columns": [
            { "key": "area", "label": "Area" },
            { "key": "checks", "label": "Checks", "align": "right" },
            { "key": "state", "label": "State" }
          ],
          "rows": [
            { "area": "Intent", "checks": 4, "state": "covered" },
            { "area": "Claims", "checks": 5, "state": "covered" },
            { "area": "Charts", "checks": 6, "state": "covered" },
            { "area": "Trust", "checks": 4, "state": "covered" }
          ]
        }
      }
    },
    {
      "type": "filterable-cards",
      "title": "Acceptance checks",
      "group": "verification",
      "status": "ready",
      "filterLabel": "Check state",
      "items": [
        {
          "title": "Keyboard controls",
          "group": "pass",
          "body": "Filters and copy buttons keep labels and focus-visible styling."
        },
        {
          "title": "Color is not the only signal",
          "group": "pass",
          "body": "Each bar includes a text label, numeric value, and state label."
        }
      ]
    }
  ],
  "evidence": [
    {
      "id": "evidence-chart-fixture",
      "kind": "source",
      "label": "Chart acceptance fixture",
      "value": ".codex/skills/effective-interact/assets/fixtures/chart-accessibility-stress-report.json",
      "status": "info",
      "sourceType": "fixture",
      "filePath": ".codex/skills/effective-interact/assets/fixtures/chart-accessibility-stress-report.json",
      "line": 1,
      "extractDate": "2026-05-18",
      "trustLevel": "mixed-trust"
    }
  ],
  "verification": [
    {
      "label": "Chart fallback",
      "status": "pass",
      "detail": "The chart includes a table fallback and source metadata."
    }
  ],
  "nextActions": [
    "Run create-interaction.mjs for this fixture.",
    "Run validate-interaction.mjs with --require-browser when browser support is available."
  ]
}
